{
  "$schema": "https://json-schema.org/draft/2020-12/schema",
  "$id": "https://folio.local/schemas/types/venn.schema.json",
  "title": "Folio Venn Authoring Input",
  "type": "object",
  "additionalProperties": false,
  "required": ["schema_version", "kind", "title", "sets", "intersections"],
  "allOf": [{"if":{"properties":{"canvas":{"const":"poster"}},"required":["canvas"]},"else":{"properties":{"height":{"maximum":800}}}}],
  "properties": {
    "schema_version": {"const": "3.0"}, "kind": {"const": "venn"},
    "title": {"$ref": "#/$defs/non-empty-string"},
    "sets": {"type": "array", "minItems": 2, "maxItems": 3, "items": {"$ref": "#/$defs/set"}},
    "intersections": {"type": "array", "items": {"$ref": "#/$defs/intersection"}},
    "focus": {"type": "array", "maxItems": 1, "uniqueItems": true, "items": {"$ref": "#/$defs/non-empty-string"}},
    "canvas": {"enum": ["figure", "poster"]},
    "width": {"const": 960}, "height": {"type": "integer", "minimum": 500, "maximum": 4000, "multipleOf": 4},
    "language": {"$ref": "#/$defs/nullable-string"}
  },
  "$defs": {
    "nullable-string": {"oneOf": [{"type": "null"}, {"$ref": "#/$defs/non-empty-string"}]},
    "non-empty-string": {"type": "string", "pattern": ".*\\S.*"},
    "string-list": {"type": "array", "items": {"$ref": "#/$defs/non-empty-string"}},
    "set": {
      "type": "object", "additionalProperties": false, "required": ["id", "label", "exclusive"],
      "properties": {
        "id": {"$ref": "#/$defs/non-empty-string"}, "label": {"$ref": "#/$defs/non-empty-string"},
        "exclusive": {"$ref": "#/$defs/string-list"}
      }
    },
    "intersection": {
      "type": "object", "additionalProperties": false, "required": ["id", "sets", "items"],
      "properties": {
        "id": {"$ref": "#/$defs/non-empty-string"},
        "sets": {"type": "array", "minItems": 2, "maxItems": 3, "uniqueItems": true, "items": {"$ref": "#/$defs/non-empty-string"}},
        "items": {"$ref": "#/$defs/string-list"}
      }
    }
  }
}
